Artist,Album,Title,Genre,Comments,music_folder,image_folder,lyrics,
Snoop Dogg,BODR,Daddy (feat. Emo Trap),,PMEDIA,/songs/06. Daddy (feat. Emo Trap).mp3,/image/cover-89.jpg,"Daddy Lyrics
Say, boo, what's happenin'?
I need you to come see me on Saturday, alright?
Got this plan I need to run by, 'kay?
Alright, Daddy love you too
Daddy, daddy, da-da-daddy, daddy
Daddy, daddy, da-daddy (Uh, uh), daddy (Yeah, yeah)
Daddy, daddy, da-daddy

Scoot up Lamborghini with lil' shawty, she the baddest
She gon' roll the weed, shoot the gun, she a savage
She put up with my shit, so if she want it, I'ma grab it
Ice all on your neck, I put them horses in the carriage
Scoot up Lamborghini with lil' shawty, she the baddest
She gon' roll the weed, shoot the gun, she a savage
She put up with my shit, so if she want it, I'ma grab it
Ice all on your neck, I put them horses in the carriage
Break laws, big kahunas, and big balls
Bad bitches, I break 'em off, the big boss is back at you, pissed off
She ain't got no direction, she a bit lost
I kick it off at my penthouse loft downtown 'cross the city
She saditty, but we don't really fall in that category
She go silly for Daddy
Cincinnati bread, she do what Daddy said
From gourmet meal cookin' to givin' Daddy some head
All her bottoms is red, niggas draped in blue
Never broke a stare, she make it do what it do
Welcome to my family, from me to you
I ain't your father, I'm your daddy, bitch
Keep Daddy rich
Hold it down and don't let Daddy slip
I'm out of town, I'll be back, daddy trip
I'm gone, sit back and watch Daddy dip (Yeah)

Scoot up Lamborghini with lil' shawty, she the baddest
She gon' roll the weed, shoot the gun, she a savage
She put up with my shit, so if she want it, I'ma grab it
Ice all on your neck, I put them horses in the carriage
Scoot up Lamborghini with lil' shawty, she the baddest
She gon' roll the weed, shoot the gun, she a savage
She put up with my shit, so if she want it, I'ma grab it
Ice all on your neck, I put them horses in the carriage
Ooh, I ain't your father, I'm your—
Yeah, I ain't your father, I'm your—
Yeah, I ain't your father, I'm your—
I'm a big time nigga, not a bitch-flyin' nigga
Zip tie, nigga, don't try, nigga
Low patience, no fakin', I slip by, nigga
Get up in her ear, now your bitch mines, nigga
Quit lyin', nigga, your bitch for the streets
Gettin' closer to Daddy, I put her on a leash before that bitch get loose
Now we on the roof
Bitch brought the liquor, big Daddy got the juice
Five, four, three, two, one, I see her run
Captivate her mind, hop off that gun
I proceed to put the game up in her
Don't worry 'bout it, nigga, she's with a winner (Ooh-wee)
I drop the top, she light the weed up
Cruise control, I don't speed up (Ah)
Super Crip with a bitch up in the caddy
I'm not your father, bitch, I'm your daddy

She call me daddy like she don't know who her daddy is
I go up in her 'til she know I'm like a sedative
Cuttin' up like Jimmy Bones
When they pull up to my house, she gon' let 'em in
Homie like to let 'em in
Casamigo' in my body tryna settle in
I just put back on my clothes, now she wet again
She ain't trippin' 'bout no bitch that she look better than
Gotta buy my bitch a body, she my medicine
Scoot up Lamborghini with lil' shawty, she the baddest
She gon' roll the weed, shoot the gun, she a savage
She put up with my shit, so if she want it, I'ma grab it
Ice all on your neck, I put them horses in the carriage
Scoot up Lamborghini with lil' shawty, she the baddest
She gon' roll the weed, shoot the gun, she a savage
She put up with my shit, so if she want it, I'ma grab it
Ice all on your neck, I put them horses in the carriage

Da-daddy, daddy (Yeah)
Daddy, daddy (Yeah)
Da-daddy, daddy (Yeah)
Daddy, daddy (Yeah)
Da-daddy, daddy (Yeah)
Daddy, daddy (Yeah)
Da-daddy, daddy (Yeah)
Daddy, daddy (Yeah)
Da-daddy, daddy (Yeah, damn)
Daddy, daddy (Yeah, I feel like I'm forgettin' somethin')
Da-daddy, daddy (Yeah, oh, yeah)
Daddy, daddy (Yeah, I remember that shit)Embed",
Harry Styles,Fine Line,Falling,Pop,www.t.me/pmedia_music,/songs/06. Falling.mp3,/image/cover-90.jpg,"Falling Lyrics
I'm in my bed
And you're not here
And there's no one to blame but the drink in my wandering hands
Forget what I said
It's not what I meant
And I can't take it back, I can't unpack the baggage you left

What am I now? What am I now?
What if I'm someone I don't want around?
I'm falling again, I'm falling again, I'm fallin'
What if I'm down? What if I'm out?
What if I'm someone you won't talk about?
I'm falling again, I'm falling again, I'm fallin'
You said you cared, and you missed me too
And I'm well aware I write too many songs about you
And the coffee's out at the Beachwood Cafe
And it kills me 'cause I know we've run out of things we can say

What am I now? What am I now?
What if I'm someone I don't want around?
I'm falling again, I'm falling again, I'm fallin'
What if I'm down? What if I'm out?
What if I'm someone you won't talk about?
I'm falling again, I'm falling again, I'm fallin'

And I get the feeling that you'll never need me again

What am I now? What am I now?
What if you're someone I just want around?
I'm falling again, I'm falling again, I'm fallin'
What if I'm down? What if I'm out?
What if I'm someone you won't talk about?
I'm falling again, I'm falling again, I'm fallin'130Embed",
John Mayer,Essentials,Heartbreak Warfare,Rock,www.t.me/pmedia_music,/songs/06. Heartbreak Warfare.mp3,/image/cover-91.jpg,"Heartbreak Warfare Lyrics
Lightning strike
Inside my chest to keep me up at night
Dream of ways
To make you understand my pain

Clouds of sulfur in the air
Bombs are falling everywhere
It's heartbreak warfare
Once you want it to begin
No one really ever wins
In heartbreak warfare

If you want more love
Why don't you say so?
If you want more love
Why don't you say so?
Drop his name
Push it in and twist the knife again
Watch my face
As I pretend to feel no pain, pain, pain

Clouds of sulfur in the air
Bombs are falling everywhere
It's heartbreak warfare
Once you want it to begin
No one really ever wins
In heartbreak warfare

If you want more love
Why don't you say so?
If you want more love
Why don't you say so?
Just say so

How come the only way to know how high you get me
Is to see how far I fall?
God only knows how much I'd love you if you let me
But I can't break through it all
It's a heart, heartbreak
I don't care if we don't sleep at all tonight
Let's just fix this whole thing now
I swear to God we're gonna get it right
If you lay your weapon down

Red wine and Ambien
You're talking shit again
It's heartbreak warfare
Good to know it's all a game
Disappointment has a name
It's heartbreak, heartbreak

It's heartbreak warfare
It's heartbreak warfare
It's heartbreak warfare13Embed",
Oasis,Oasis - Greatest Hits CD2,Oasis  Sunday Morning Call,,,/songs/06. Oasis  Sunday Morning Call.mp3,,"Sunday Morning Call Lyrics
Here's another Sunday morning call
Yer hear yer head-a-banging on the door
Slip your shoes on and then out you crawl
Into a day that couldn't give you more
But what for?

And in your head do you feel
What you're not supposed to feel?
And you take what you want
But you don't get it for free
You need more time
'Cause your thoughts and words won't last forever more
And I'm not sure if it'll ever work out right
But it's ok
It's all right
When you're lonely and you start to hear
The little voices in your head at night
You will only sniff away the tears
So you can dance until the morning light
At what price?

And in your head do you feel
What you're not supposed to feel?
And you take what you want
But you won't get it for free
You need more time
Because your thoughts and words won't last forever more
And I'm not sure if it'll ever work out right
It's ok
It's all right

And in your head do you feel
What you're not supposed to feel?
And you take what you want
But you won't get hope for free
You need more time
Because your thoughts and words won't last forever more
And I'm not sure
If it'll ever, ever, ever work out right
If it'll ever, ever, ever work out right
Will it ever, ever, ever work out right?Embed",
Ed Sheeran,=,The Joker And The Queen,,PMEDIA,/songs/06. The Joker And The Queen.mp3,/image/cover-93.jpg,"The Joker And The Queen Lyrics
How was I to know? It's a crazy thing
I showed you my hand and you still let me win
And who was I to say that this was meant to be?
The road that was broken brought us together

And I know you could fall for a thousand kings
And hearts that would give you a diamond ring
When I fold, you see the best in me
The joker and the queen

I was upside down from the outside in
You came to the table and you went all in
With a single word and a gentle touch
You turned a moment into forever
And I know you could fall for a thousand kings
And hearts that could give you a diamond ring
When I fold, you see the best in me
The joker and the queen


And I know you could fall for a thousand kings
And hearts that would givе you a diamond ring
When I folded, you saw the bеst in me
The joker and the queen
The joker and the queen12Embed",
Imagine Dragons,Origins (Deluxe),West Coast,Alternative,Freak37,/songs/06. West Coast.mp3,/image/cover-94.jpg,"West Coast Lyrics
One more day we'll spend together
Let your eyes look up upon me for the better
Oh, I know I'm worse for weather
But, my love, I won't give up
Spend my days cursing my soul
Wishing I could paint my scars and make me whole
Oh, I know I could be better
But, my love, I won't give up

I ain't no Superman, I ain't no Holy Ghost
I'm just the one that keeps you up at night, you love the most
I'll be your strong man, I'll be your West Coast
I'll be the sun, I'll be the waves, I'll be the one you love the most
Ooh, hey, hey, hey, oh
Hey, hey, hey, hey, hey, hey, hey
I'll be, I'll be, I'll be, I'll be, I'll be your West Coast, honey
Ooh, hey, hey, hey, oh
Hey, hey, hey, hey, hey, hey, hey
I'll be, I'll be, I'll be, I'll be, I'll be your West Coast, honey
Ooh, ooh, ooh, ooh
Ooh, ooh, ooh, ooh

I'll change my ways if you would stay
And all your tears that you have cried will go away
Oh, just grant me one more day
Oh, my love, please don't give up
See the Devil at my door
I see the future of the ones that I've ignored
I guess I was born to be at war
And, my love, I won't give up
So, my love, please don't give up

I ain't no Superman, I ain't no Holy Ghost
I'm just the one who keeps you up at night, you love the most
I'll be your strong man, I'll be your West Coast
I'll be the sun, I'll be the waves, I'll be the one you love the most
Ooh, hey, hey, hey, oh
Hey, hey, hey, hey, hey, hey, hey
I'll be, I'll be, I'll be, I'll be, I'll be your West Coast, honey
Ooh, hey, hey, hey, oh
Hey, hey, hey, hey, hey, hey, hey
I'll be, I'll be, I'll be, I'll be, I'll be your West Coast, honey

Ooh, hey, hey, hey (Gonna give you that feeling)
Hey, hey, hey, hey, hey, hey, hey
I'll be, I'll be, I'll be, I'll be, I'll be your West Coast, honey (Gonna give you that feeling)
Ooh, hey, hey, hey (Gonna give you that feeling)
Hey, hey, hey, hey, hey, hey, hey
I'll be, I'll be, I'll be, I'll be, I'll be your West Coast, honey (Gonna give you that feeling)13Embed",
Oasis,Oasis - Greatest Hits CD1,Whatever,,,/songs/06. Whatever.mp3,,"Whatever Lyrics
I'm free to be whatever I
Whatever I choose and I'll sing the blues if I want
I'm free to say whatever I
Whatever I like if it's wrong or right, it's alright

Always seems to me
You only see what people want you to see
How long's it gonna be
Before we get on the bus and cause no fuss
Get a grip on yourself it don't cost much

Free to be whatever you
Whatever you say if it comes no way, it's alright
You're free to be wherever you
Wherever you please you can shoot the breeze if you want
It always seems to me
You only see what people want you to see
How long's it gonna be
Before we get on the bus and cause no fuss
Get a grip on yourself it don't cost much

Free to be whatever I
Whatever I choose and I'll sing the blues if I want

Here in my mind
You know you might find
Something that you
You thought you once knew
But now it's all gone
And you know it's no fun
You know it's no fun
And you know it's no fun

I'm free to be whatever I
Whatever I choose and I'll sing the blues if I want
I'm free to be whatever I
Whatever I choose and I'll sing the blues if I want
Whatever you do, whatever you say, I know it's alright
Whatever you do, whatever you say, I know it's alright12Embed",
Nirvana,Greatest Hits,Come As You Are,Grunge,,/songs/06.Come As You Are.mp3,/image/cover-96.jpg,"Come as You Are Lyrics
Come as you are, as you were
As I want you to be
As a friend, as a friend
As an old enemy
Take your time, hurry up
Choice is yours, don't be late
Take a rest as a friend
As an old memoria

Memoria
Memoria
Memoria
Come doused in mud, soaked in bleach
As I want you to be
As a trend, as a friend
As an old memoria
Memoria
Memoria
Memoria

And I swear that I don't have a gun
No, I don't have a gun
No, I don't have a gun


Memoria
Memoria
Memoria
Memoria (No, I don't have a gun)

And I swear that I don't have a gun
No, I don't have a gun
No, I don't have a gun
No, I don't have a gun
No, I don't have a gun

Memoria
Memoria146Embed",
Coldplay,Greatest Songs,Adventure Of A Lifetime,Rock / (131),https://musicriders.blogspot.com (or) Mega Zone Riders,/songs/07 - Adventure Of A Lifetime.mp3,/image/cover-97.jpg,"Adventure of a Lifetime Lyrics

Turn your magic on, Umi, she'd say
Everything you want's a dream away
And we are legends, every day
That's what she told me

Turn your magic on, to me she'd say
Everything you want's a dream away
Under this pressure, under this weight
We are diamonds

Now I feel my heart beating
I feel my heart underneath my skin
And I feel my heart beating
Oh, you make me feel
Like I'm alive again
Alive again
Oh, you make me feel
Like I'm alive again

Said I can't go on, not in this way
I'm a dream that died by light of day
Gonna hold up half the sky and say
Only I own me

Now I feel my heart beating
I feel my heart underneath my skin
Oh, I can feel my heart beating
'Cause you make me feel
Like I'm alive again

Alive again
Oh, you make me feel
Like I'm alive again

Turn your magic on, Umi, she'd say
Everything you want's a dream away
Under this pressure, under this weight
We are diamonds taking shape
We are diamonds taking shape
(Woo, woo)
If we've only got this life
This adventure, oh then I
And if we've only got this life
You'll get me through
And if we've only got this life
In this adventure, oh then I
Want to share it with you
With you, with you
Yeah, I do

(Woo-hoo, woo-hoo)
(Woo-hoo, woo-hoo)
(Woo-hoo, woo-hoo)
(Woo-hoo, woo-hoo)
(Woo-hoo, woo-hoo)
(Woo-hoo, woo-hoo)52Embed",
Dua Lipa,Dua Lipa,Garden,Indie Pop / Pop,Hunter,/songs/07 - Garden.mp3,/image/cover-98.jpg,"Garden Lyrics
Remember when we swam in the ocean?
Now we know what's deep inside
Remember when we ran in the open?
Now we know what's in the wild
Used to think that this love was Heaven sent
How did we get lost? Can't get back again
Tell me, is there light on the outside?

So are we leaving this Garden of Eden?
Are we leaving this Garden of Eden?

Used to walk around your apartment
Nothing but a smile on me
But tonight I'm so self conscious
Isn't it so clear to see?
Nothing's ever perfect in Paradise
Don't know what it's worth 'til you pay the price
When you bite your tongue does it draw blood?
So are we leaving this Garden of Eden?
Are we leaving this Garden of Eden?
Now I know what I know
But it’s hard to find the meaning
Where do we go?
'Cause we don't believe in this Garden of Eden
(Eden, Eden, Eden)
This Garden of Eden?
(Eden, Eden, Eden)

I have cried for you, and I'll ride for you
I would die for you, but would you do that for me?
Tell the truth, what you wanna do
Is it me and you?
Are you with me, honey?
I have cried for you, and I'll ride for you
I would die for you, but would you do that for me?
Tell the truth, what you wanna do
Is it me and you?
Are you with me?

So are we leaving this Garden of Eden?
Are we leaving this Garden of Eden?
Now I know what I know
But it's hard to find the meaning
Where do we go?
'Cause we don't believe in this Garden of Eden
(Eden, Eden, Eden)
This garden of Eden
(Eden, Eden, Eden)
Remember when we swam in the ocean?
Now we know what's deep inside
Remember when we ran in the open?

So are we leaving?
(Are we leaving this Garden of Eden?)
Are we leaving?
(Are we leaving this Garden of Eden?)
Now I know what I know
But it's hard to find the meaning
Where do we go?
'Cause we don't believe in this Garden of Eden
(Eden, Eden, Eden)
This garden of Eden
(Eden, Eden, Eden)20Embed",
Ed Sheeran,÷,Happier,,Freak37,/songs/07 - Happier.mp3,/image/cover-99.jpg,"Happier Lyrics
Walking down 29th and park
I saw you in another's arm
Only a month we've been apart
You look happier
Saw you walk inside a bar
He said something to make you laugh
I saw that both your smiles were twice as wide as ours
Yeah, you look happier, you do

Ain't nobody hurt you like I hurt you
But ain't nobody love you like I do
Promise that I will not take it personal, baby
If you're moving on with someone new
'Cause baby you look happier, you do
My friends told me one day I'll feel it too
And until then I'll smile to hide the truth
But I know I was happier with you

Sat in the corner of the room
Everything's reminding me of you
Nursing an empty bottle and telling myself
You're happier, aren't you?

Oh, ain't nobody hurt you like I hurt you
But ain't nobody need you like I do
I know that there's others that deserve you
But my darling, I am still in love with you

But I guess you look happier, you do
My friends told me one day I’ll feel it too
I could try to smile to hide the truth
But I know I was happier with you

‘Cause baby you look happier, you do
I knew one day you’d fall for someone new
But if he breaks your heart like lovers do
Just know that I’ll be waiting here for you111Embed",
Frank Sinatra,Platinum Selection,I’m Walking Behind You,"Vocal Jazz, Pop",Freak37,/songs/07 - I'm Walking Behind You.mp3,/image/cover-100.jpg,"I’m Walking Behind You LyricsI'm walking behind you on your wedding day
And I'll hear you promise to love and obey
Though you may forget me, you're still on my mind
Look over your shoulder, I'm walking behind
Maybe I'll kiss again with a love that's new again
But I shall wish again I was kissing you
'Cause I'll always love you wherever you go
And though we are parted, I want you to know
That if things go wrong, dear, and fate is unkind
Look over your shoulder, I'm walking behind
So if things go wrong, dear, and fate is unkind
Look over your shoulder, I'm walking behindEmbed",
One Direction,Take Me Home,Rock Me,Pop,,/songs/07 - Rock Me.mp3,/image/cover-101.jpg,"Rock Me Lyrics

Do you remember summer '09?
Wanna go back there every night
Just can't lie, was the best time of my life
Lying on the beach as the sun blew out
Playing this guitar by the fire too loud
Oh my, my, they could never shut us down

I used to think that I was better alone
Why did I ever wanna let you go?
Under the moonlight as we stared at the sea
The words you whispered, I will always believe
I want you to rock me, rock me, rock me, yeah
I want you to rock me, rock me, rock me, yeah
I want you to hit the pedal, heavy metal, show me you care
I want you to rock me, rock me, rock me, yeah

We were together, summer '09
Wanna roll back like pressing rewind
You were mine and we never said goodbye

I used to think that I was better alone (Better alone)
Why did I ever wanna let you go? (Let you go)
Under the moonlight as we stared at the sea (Stared at the sea)
The words you whispered I will always believe

I want you to rock me, rock me, rock me, yeah
I want you to rock me, rock me, rock me, yeah
I want you to hit the pedal, heavy metal, show me you care
I want you to rock me, rock me, rock me, yeah

R-O-C-K me again, R-O-C-K me again
R-O-C-K me again, yeah
I want you to R-O-C-K me again, R-O-C-K me again
R-O-C-K me again, yeah
I want you to rock me, rock me, rock me, yeah
I want you to rock me, rock me, rock me, yeah
I want you to hit the pedal, heavy metal, show me you care
I want you to rock me, rock me, rock me, yeah (Rock me, yeah)

I want you to rock me, rock me, rock me, yeah (Rock me, yeah)
I want you to rock me, rock me, rock me, yeah
I want you to hit the pedal, heavy metal, show me you care (Show me you care)
I want you to rock me, rock me, rock me, yeah32Embed",
The Beatles,With The Beatles (Remastered),All My Loving,(17)Rock,,/songs/07 all my loving.mp3,,"All My Loving Lyrics
Close your eyes and I'll kiss you
Tomorrow I'll miss you
Remember I'll always be true
And then while I'm away
I'll write home everyday
And I'll send all my loving to you

I'll pretend that I'm kissing
The lips I am missing
And hope that my dreams will come true
And then while I'm away
I'll write home everyday
And I'll send all my loving to you
All my loving I will send to you
All my loving, darling, I'll be true

Close your eyes and I'll kiss you
Tomorrow I'll miss you
Remember I'll always be true
And then while I'm away
I'll write home everyday
And I'll send all my loving to you

All my loving I will send to you
All my loving, darling, I'll be true
All my loving, all my loving, ooh
All my loving I will send to you12Embed",
Camila Cabello,Familia,Boys Don't Cry,Pop,,/songs/07 Boys Don't Cry.mp3,/image/cover-103.jpg,"Boys Don’t Cry Lyrics
I know thoughts you don't want in your head
Are spinnin' round-round-round
I know you got demons from the past
Slowin' you down-down-down
But you don't answer your FaceTime
You never had much of a poker face
It doesn't make you less of a man
You're just human right now

When I'm afraid of the world, when every part of me hurts
You don't know how many times you've saved me
So why you hidin' from me? It's only makin' it worse
I just wanna be close, my baby
Give me your pain, I'll take the weight off your shoulders
Don't be afraid, fall into me, let me hold ya
We weren't made to hold back the rain  from the sky
Who ever told you that boys don't cry, boys don't cry?

Hate it when you shut me out
Actin' like it's your shit to figure out
Don't wanna be touched, don't wanna discuss
I get it, I just, uh
Now I'm in my head about what's in your head
Come back to bed, can we talk about it?
It's not stupid, it's not drama
It's just trauma turned to armor
Keepin' you from me, no performing
If you love me, come and touch me, yeah

When I'm afraid of the world, when every part of me hurts
You don't know how many times you've saved me
So why you hidin' from me? It's only makin' it worse
I just wanna be close, my baby

Give me your pain, I'll take the weight off your shoulders
Don't be afraid, fall into me, let me hold ya
We weren't made to hold back the rain  from the sky
Yeah, who ever told you that boys don't cry, boys don't cry?
Yeah-yeah-yeah-yeah
Boys don't cry, boys don't cry
Yeah-yeah-yeah-yeah
Boys don't cry, boys don't cry

Come, my baby, lay your head on me
Lay your head on me, lay your head on me
Come, my baby, lay your head on me
Lay your head on me, lay your head on me (You know I got ya)
Come, my baby, lay your head on me (And you know I'd do anything for ya)
Lay your head on me, lay your head on me
Come, my baby, lay your head on me
Lay your head on me, lay your head on me

Give me your pain, I'll take the weight off your shoulders
Don't be afraid, fall into me, let me hold ya
We weren't made to hold back the rain from the sky
Who ever told you that boys don't cry, boys don't cry?

Ooh-oh
Boys don't cry, boys don't cry3Embed",
Snow Patrol,Greatest Hits,Just Say Yes,Alternative,,/songs/07 Snow Patrol - Just Say Yes.mp3,/image/cover-104.jpg,"Just Say Yes LyricsVerse 1:
I'm running out of ways to make you see
I want you to stay here beside me
I won't be okay and I won't pretend I am
So just tell me today and take my hand
Please take my hand
Please take my hand
Please take my hand
Please take my hand
Chorus:
Just say yes
Just say there's nothing holding you back
It's not a test, nor a trick of the mind
Only love
Verse 2:
It's so simple and you know it is
You know it is
We can't be to and fro like this
All our lives
You're the only way to me
The path is clear
What do I have to say to you?
For God's sake, dear
For God's sake, dear
For God's sake, dear
For God's sake, dear
For God's sake, dear
Chorus:
Just say yes
Just say there's nothing holding you back
It's not a test, nor a trick of the mind
Only love
Bridge:
I can feel your heart beat through my shirt
This was all I wanted, all I want
It's all I want
It's all I want
It's all I want
It's all I want
Chorus:
Just say yes
Just say there's nothing holding you back
It's not a test, nor a trick of the mind
Only love
Chorus/Outro:
Just say yes
Cause I'm aching, I know you are too
For the touch of your warm skin
As I breathe you in3Embed",
