Artist,Album,Title,Genre,Comments,music_folder,image_folder,lyrics,
John Mayer,Essentials,Dreaming with a Broken Heart,Pop,www.t.me/pmedia_music,/songs/18. Dreaming with a Broken Heart.mp3,/image/cover-282.jpg,"Dreaming With a Broken Heart Lyrics
When you’re dreaming with a broken heart
The waking up is the hardest part
You roll out of bed and down on your knees
And for a moment, you can hardly breathe
Wondering, “Was she really here?
Is she standing in my room?”
No she’s not
‘Cause she’s gone, gone, gone, gone, gone

When you’re dreaming with a broken heart
The giving up is the hardest part
She takes you in, with her crying eyes
Then, all at once, you have to say goodbye
Wondering, “could you stay my love?
Will you wake up by my side?”
No she can’t
‘Cause she’s gone, gone, gone, gone, gone
Now, do I have to fall asleep with roses in my hand?
Do I have to fall asleep with roses in my hand?
Now, do I have to fall asleep with roses in my hand?
Do I have to fall asleep with roses in my, roses in my hands?
And would you get them if I did?
No you won’t
‘Cause you’re gone, gone, gone, gone, gone

When you’re dreaming with a broken heart
The waking up is the hardest part16Embed",
Snoop Dogg,BODR,Snoopy Don’t Go (feat. October London),,PMEDIA,/songs/18. Snoopy Don’t Go (feat. October London).mp3,/image/cover-283.jpg,"Snoopy Don’t Go Lyrics
Ah
Damn, Snoopy, don't go
You almost thirty years in the game, baby, damn
I mean, who else is gon' do something like that? I mean, damn
You the king, baby
So you know they don't want you to leave, Snoopy

(Snoopy, don't go, ooh, ooh, ooh)
I hate to leave but I have to
(Snoopy, don't go, ooh, ooh)
I know, I know, baby
(Snoopy, don't go, ooh, ooh, ooh)
I hate to leave but I have to
(Snoopy, don't go, ooh, ooh)
Baby, I'm just a man with good hands like Allstate
And you are now addicted to this lovin'
Let me explore your love 'cause my time is short today
And now you're conflicted, and this is what she had to say

(Ah, I need you right back to me, Snoopy)
I, I gotta go, baby, I'd love to stay
(I need you back in my arms, Snoopy)

(Snoopy, don't go, ooh, ooh, ooh)
Oh baby, I wish I had time to stay and play but
(Snoopy, don't go, ooh, ooh)
You know time is money and money is time, baba
(Snoopy, don't go, ooh, ooh, ooh)
I guess we can get together some other time
(Snoopy, don't go, ooh, ooh)
'Cause my time is precious, you dig?

Ah, ha, you can't just leave like that, Snoopy
You gotta stay a little while longer
You know that's what they want
Don't go
Baby, I got to go far away for a while
And I don't think you can handle coming with me (No, uh-uh)
You know show after show, and mile after mile
And I don't think you can handle running with me
So I don't think you'll be coming with me

I gotta go (Ah, I need you right back to me, Snoopy)
Look, baby, I got places to be and people to see
(I need you back in my arms, Snoopy)

(Snoopy, don't go, ooh, ooh, ooh)
I hate to leave but I have to
(Snoopy, don't go, ooh, ooh)
I know, I know, baby
(Snoopy, don't go, ooh, ooh, ooh)
I hate to leave but I have to
(Snoopy, don't go, ooh, ooh)

(Snoopy don't, Snoopy don't, Snoopy, don't go)
Oh baby, I wish I had time to stay and play but
(Snoopy don't, Snoopy don't, Snoopy, don't go)
You know time is money and money is time, baba
(Snoopy don't, Snoopy don't, Snoopy, don't go)
I guess we can get together some other time
(Snoopy don't, Snoopy don't, Snoopy, don't go)
I hate to leave but I have to
Yeah, if you wanna go to a record label where the executive producer is all in the videos, rappin', and dancin'
Come to Death RowEmbed",
Frank Sinatra,Platinum Selection,Bim Bam Baby,"Vocal Jazz, Pop",Freak37,/songs/19 - Bim Bam Baby.mp3,/image/cover-284.jpg,"Bim Bam Baby LyricsHey now
Take a mip mack mop and a brim bram broom
And klim klam clean up the rim ram room
'Cause your bim bam baby`s coming home tonight
Get my slim slam slippers and my easy chair
Run you flim flam fingers through my greasy hair
Then kiss me, baby, let me hold you tight
Been north and south and east and west
But even a honey bee needs some rest
When I get my jacket and my trousers pressed
I'll follow the swallow right back to my nest
Don't you wim wam worry if my train is late
Gonna shim sham shuttle on a frim fram freight
'Cause your bim bam baby is coming home tonight
Grab a mip mack mop and a brim bram broom
Klim klam clean up the rim ram room
'Cause your bim bam baby`s coming home tonight
Get my slim slam slippers and my easy chair
Run you greasy fingers through my greasy hair
Then kiss me, baby, let me hold you tight
I been north and south and east and west
But even a honey bee needs some rest
When I get my jacket and my pants all pressed
I'll follow the swallow right back to my nest
Don't you wim wam worry if my choo choo's late
Gonna shim sham shuttle on a frim fram freight
'Cause your bim bam baby is coming home tonight
'Cause your bim bam baby is coming home tonight
Open that door, baby, 'cause here I comeEmbed",
Coldplay,Greatest Songs,Every Teardrop Is A Waterfall,Rock / (131),https://musicriders.blogspot.com (or) Mega Zone Riders,/songs/19 - Every Teardrop Is A Waterfall.mp3,/image/cover-285.jpg,"Every Teardrop Is a Waterfall Lyrics
I turn the music up, I got my records on
I shut the world outside until the lights come on
Maybe the streets alight, maybe the trees are gone
I feel my heart start beating to my favorite song
And all the kids they dance, all the kids all night
Until Monday morning feels another life
I turn the music up, I'm on a roll this time
And Heaven is in sight

I turn the music up, I got my records on
From underneath the rubble, sing a rebel song
Don't want to see another generation drop
I'd rather be a comma than a full stop
Maybe I'm in the black, maybe I'm on my knees
Maybe I'm in the gap between the two trapezes
But my heart is beating and my pulses start
Cathedrals in my heart
As we saw, oh, this light
I swear you, emerge blinking in to
To tell me it's alright
As we soar walls
Every siren is a symphony

And every tear's a waterfall
Is a waterfall, oh
Is a waterfall, oh-oh-oh
Is a, is a waterfall
Every tear
Is a waterfall, oh-oh-oh

So you can hurt, hurt me bad
But still, I'll raise the flag

Oh, it was a wa-wa-wa-wa-waterfall
A wa-wa-wa-wa-waterfall
Every tear, every tear
Every teardrop is a waterfall
Every tear, every tear
Every teardrop is a waterfall
Every tear, every tear
Every teardrop is a waterfall
Every tear, every tear
Every teardrop is a waterfall
Every tear, every tear
Every teardrop is a waterfall26Embed",
The Chainsmokers;Louane,100% Chainsmokers,It Won't Kill Ya,Pop,,/songs/19 - The Chainsmokers - It Won't Kill Ya.mp3,/image/cover-286.jpg,"It Won’t Kill Ya Lyrics
I know as the night goes on
You might end up with someone
So why do I bite my tongue?
Oh, I wanna know ya
I'm lookin' around the room
Is one of those strangers you?
And do you notice me too?
Oh, I wanna know ya

(I want ya) You're a face I won't forget
(I want ya) Don't know how much time is left
(I want ya) Haven't had a moment yet
Ooh
Oh, dance with me, it won't kill ya
And one for the road
Dance with me, it won't kill ya
And one before you go
Dance with me, it won't kill ya
And one for the road
So why won't you stay a little longer?

Dance with me
Dance with me
(Mon amour)

You're putting your jacket on
Oh no, is the moment gone?
Don't wanna regret this one
Ooh, I wanna know ya

(I want ya) You're a face I won't forget
(I want ya) Don't know how much time is left
(I want ya) Haven't had a moment yet
Ooh
Oh, dance with me, it won't kill ya
And one for the road
Dance with me, it won't kill ya
And one before you go
Dance with me, it won't kill ya
And one for the road
So why won't you stay a little longer?

Dance with me
(Mon amour)
Dance with me
(Mon amour)

I know as the night goes on
You might end up with someone
So why do I bite my tongue?
Ooh, I wanna know ya

Oh, dance with me, it won't kill ya
And one for the road
Dance with me, it won't kill ya
And one before you go
Dance with me, it won't kill ya
And one for the road
So why won't you stay a little longer?
So why don't you stay a little longer?
So why don't you stay a little longer?
Woah, woah, yeah
So why don't you stay a little longer?

So why don't you stay a little longer?
(So why don't you stay a little longer?)8Embed",
The Beatles,Please Please Me (Remastered),Love Me Do,(17)Rock,,/songs/19 love me do.mp3,,"Love Me Do Lyrics
Love, love me do
You know I love you
I'll always be true
So please, love me do
Whoa, love me do

Love, love me do
You know I love you
I'll always be true
So please, love me do
Whoa, love me do

Someone to love
Somebody new
Someone to love
Someone like you
Love, love me do
You know I love you
I'll always be true
So please, love me do
Whoa, love me do


Love, love me do
You know I love you
I'll always be true
So please, love me do
Whoa, love me do
Yeah, love me do

Whoa, oh, love me do
Yeah, love me do
Why don't you love me do?13Embed",
Taylor Swift,Essentials,Mine,Pop,Freak37,/songs/19 Mine.mp3,/image/cover-288.jpg,"Mine Lyrics
You were in college, working part-time, waiting tables
Left a small town and never looked back
I was a flight risk, with a fear of falling
Wondering why we bother with love, if it never lasts

I say, ""Can you believe it?""
As we're lying on the couch
The moment, I could see it
Yes, yes, I can see it now

Do you remember, we were sitting there, by the water?
You put your arm around me for the first time
You made a rebel of a careless man's careful daughter
You are the best thing that's ever been mine
Flash forward, and we're taking on the world together
And there's a drawer of my things at your place
You learn my secrets and you figure out why I'm guarded
You say we'll never make my parents' mistakes

But we got bills to pay
We got nothing figured out
When it was hard to take
Yes, yes
This is what I thought about:

Do you remember, we were sitting there, by the water?
You put your arm around me for the first time
You made a rebel of a careless man's careful daughter
You are the best thing that's ever been mine
Do you remember all the city lights on the water?
You saw me start to believe for the first time
You made a rebel of a careless man's careful daughter
You are the best thing that's ever been mine

And I remember that fight, 2:30 A.M
As everything was slipping right out of our hands
I ran out, crying, and you followed me out into the street
Braced myself for the goodbye
'Cause that's all I've ever known
Then, you took me by surprise
You said, ""I'll never leave you alone.""
You said, ""I remember how we felt, sitting by the water
And every time I look at you, it's like the first time
I fell in love with a careless man's careful daughter
She is the best thing that's ever been mine""
Hold on, make it last
Hold on, never turn back
You made a rebel of a careless man's careful daughter
You are the best thing that's ever been mine

Yeah, yeah
Do you believe it? (Hold on)
We're gonna make it now (Hold on)
And I can see it
Yeah, yeah
I can see it now (See it now)40Embed",
Katy Perry,Smile (Deluxe),Smile,Pop,Freak37,/songs/19. Smile (feat. Diddy) [Bonus Track].mp3,/image/cover-289.jpg,"Smile Lyrics
Yeah, I'm thankful
Scratch that, baby, I'm grateful
Gotta say it's really been a while
But now I got back that smile (Smile)
I'm so thankful
Scratch that, baby, I'm grateful
Now you see me shine from a mile
Finally got back that smile (Smile)

Every day, Groundhog Day
Goin' through motions felt so fake
Not myself, not my best
Felt like I failed the test
But every tear has been a lesson
Rejection can be God's protection
Long hard road to get that redemption
But no shortcuts to a blessin'

Yeah, I'm thankful
Scratch that, baby, I'm grateful
Gotta say it's really been a while
But now I got back that smile (Smile)
I'm so thankful
Scratch that, baby, I'm grateful
Now you see me shine from a mile
Finally got back that smile (Smile)

I'm 2.0, remodeled
Used to be dull, now I sparkle
Had a piece of humble pie
That ego check saved my life

Now I got a smile like Lionel Richie
Big and bright, need shades just to see me
Tryna stay alive just like I'm the Bee Gees (Oh, woah)
A Mona Lisa masterpiece (Now I'm)
Yeah, I'm thankful
Scratch that, baby, I'm grateful
Gotta say it's really been a while
But now I got back that smile (C'mon, smile, woo)
I'm so thankful
Scratch that, baby, I'm grateful (So grateful)
Now you see me shine from a mile
Finally got back that smile (Smile, oh, oh)

I'm so thankful
'Cause I finally, 'cause I finally
I'm so grateful
'Cause I finally, 'cause I finally (Oh)

Yeah, I'm thankful
Scratch that, baby, I'm grateful
Gotta say it's really been a while
But now I got back that smile (Woo, smile)
I'm so thankful
Scratch that, baby, I'm grateful
Now you see me shine from a mile
Finally got back that smile (Smile, oh, oh)
I'm so thankful
'Cause I finally, 'cause I finally
Smile (Oh)
I'm so grateful
'Cause I finally, 'cause I finally
Smile (Oh, oh)44Embed",
John Mayer,Essentials,Who Says,Rock,www.t.me/pmedia_music,/songs/19. Who Says.mp3,/image/cover-290.jpg,"Who Says Lyrics
Who says I can’t get stoned?
Turn off the lights and the telephone
Me, in my house alone
Who says I can’t get stoned?
Who says I can’t be free?
From all of the things that I used to be
Re-write my history
Who says I can’t be free?

It’s been a long night in New York City
It’s been a long night in Baton Rouge
I don’t remember you looking any better
But then again, I don’t remember you
Who says I can’t get stoned?
Call up a girl that I used to know
Fake love for an hour or so
Who says I can’t get stoned?
Who says I can’t take time?
Meet all the girls on the county line
Wait on fate to send a sign
Who says I can’t take time?

It’s been a long night in New York City
It’s been a long night in Austin too
I don’t remember you looking any better
But then again, I don’t remember you

Who says I can’t get stoned?
Plan a trip to Japan alone
Doesn’t matter if I even go
Who says I can’t get stoned?

It’s been a long night in New York City
It’s been a long time since 22
I don’t remember you looking any better
But then again I don’t remember, don't remember you14Embed",
The Chainsmokers;Nghtmre,100% Chainsmokers,Save Yourself,Pop,,/songs/2 - The Chainsmokers - Save Yourself.mp3,/image/cover-291.jpg,"Save Yourself Lyrics
I should have known what I started
You should know where your heart is
But I don't, I won't be a part of
Expectations when I grow up

So call it what you call it
But I just won't be afraid of myself
'Cause I know that I got it
I won't give it up just to save myself

One, two, three
One, two, three
I hit it 'til it's hollow
It's your pride you should swallow
But I won't, I'm not one to follow
I won't explain all the things I love

So call it what you call it
I'll be the first one to blame myself
'Cause I know I get caught up
I won't give it up just to save myself

One, two, three8Embed",
Taylor Swift,Essentials,Blank Space,Pop,Freak37,/songs/2 Blank Space.mp3,/image/cover-292.jpg,"Nice to meet you, where you been?
I could show you incredible things
Magic, madness, heaven, sin
Saw you there and I thought
""Oh, my God, look at that face
You look like my next mistake
Love's a game, wanna play?"" Ay
New money, suit and tie
I can read you like a magazine
Ain't it funny rumors fly
And I know you heard about me
So hey, let's be friends
I'm dying to see how this one ends
Grab your passport and my hand
I can make the bad guys good for a weekend
So it's gonna be forever
Or it's gonna go down in flames
You can tell me when it's over, mmh
If the high was worth the pain
Got a long list of ex-lovers
They'll tell you I'm insane
'Cause you know I love the players
And you love the game
'Cause we're young and we're reckless
We'll take this way too far
It'll leave you breathless
Or with a nasty scar
Got a long list of ex-lovers
They'll tell you I'm insane
But I've got a blank space, baby
And I'll write your name
Cherry lips, crystal skies
I could show you incredible things
Stolen kisses, pretty lies
You're the King, baby, I'm your Queen
Find out what you want
Be that girl for a month
Wait, the worst is yet to come, oh, no
Screaming, crying, perfect storms
I can make all the tables turn
Rose garden filled with thorns
Keep you second guessing like
""Oh, my God, who is she?""
I get drunk on jealousy
But you'll come back each time you leave
'Cause, darling, I'm a nightmare dressed like a daydream
So it's gonna be forever
Or it's gonna go down in flames
You can tell me when it's over, mmh
If the high was worth the pain
Got a long list of ex-lovers
They'll tell you I'm insane
'Cause you know I love the players
And you love the game
'Cause we're young and we're reckless (oh)
We'll take this way too far
It'll leave you breathless (oh)
Or with a nasty scar
Got a long list of ex-lovers
They'll tell you I'm insane (insane)
But I've got a blank space, baby
And I'll write your name
Boys only want love if it's torture
Don't say I didn't say, I didn't warn ya
Boys only want love if it's torture
Don't say I didn't say, I didn't warn ya
So it's gonna be forever
Or it's gonna go down in flames
You can tell me when it's over (over)
If the high was worth the pain
Got a long list of ex-lovers
They'll tell you I'm insane (I'm insane)
'Cause you know I love the players
And you love the game
'Cause we're young and we're reckless
We'll take this way too far (ooh)
It'll leave you breathless, mmh
Or with a nasty scar (leave a nasty scar)
Got a long list of ex-lovers
They'll tell you I'm insane
But I've got a blank space, baby
And I'll write your name",
Katy Perry,Smile (Deluxe),Cry about it later,Pop,Freak37,/songs/2. Cry About It Later.mp3,/image/cover-293.jpg,"Cry About It Later Lyrics
I'll cry about it later
I'll cry about it later
Tonight, I'm havin' fun
Tonight, I'm havin' fun
I'll cry about it later
I'll cry about it later
Tonight I'm gettin' some
Tonight I'm gettin' something brand new

I know tomorrow, I'll be love hungover
But I'm ready for a shameless summer
Champagne on ice only makes you stronger

Pourin' it, pourin' it, pourin' it nonstop (Ah)
Drinkin' it, drinkin' it, drinkin' it all up (Ah)
Body to body, I almost forgot
You're not him, you're not her
I'll cry about it later
I'll cry about it later
Tonight, I'm havin' fun
Tonight, I'm havin' fun
I'll cry about it later
I'll cry about it later
Tonight I'm gettin' some
Tonight I'm gettin' something brand new

I think I'm ready to be someone's new muse
I think I'm ready for a brand new tattoo (Give me it)
I'm gonna fake it 'til it makes me feel good

Pourin' it, pourin' it, pourin' it nonstop (One more; ah, ooh)
Drinkin' it, drinkin' it, drinkin' it all up (Ah, ooh)
Body to body, I almost forgot
You're not him, you're not her, yeah

I'll cry about it later
I'll cry about it later
Tonight, I'm havin' fun
Tonight, I'm havin' fun
I'll cry about it later
I'll cry about it later
Tonight I'm gettin' some
Tonight I'm gettin' some
I'll cry about it later
I'll cry about it later
Tonight, I'm havin' fun
Tonight, I'm havin' fun
I'll cry about it later
I'll cry about it later
Tonight I'm gettin' some
Tonight I'm gettin' something brand new
Ooh
I know tomorrow, I'll be love hungover (Ooh)
And it's half past three (Past three)
And I got angel wings (Wings)
But a devil's grin
And only one can win
No, no, no, no

I'll cry about it later
I'll cry about it later
Tonight, I'm havin' fun
Tonight, I'm havin' fun
I'll cry about it later
I'll cry about it later
Tonight I'm gettin' some
Tonight I'm gettin' some (Ooh, ooh)
I'll cry about it later
I'll cry about it later
Tonight, I'm havin' fun
Tonight, I'm havin' fun (Ooh, I'll cry about it later)
I'll cry about it later
I'll cry about it later
Tonight I'm gettin' some
Tonight I'm gettin' something brand new8Embed",
Calum Scott,Only Human (Deluxe),Give Me Something,-13,https://musicriders.blogspot.com,/songs/2. Give Me Something.mp3,/image/cover-294.jpg,"Give Me Something Lyrics
I called your number 'bout a hundred times
And I know, that you know that it's me
I sat and listened for hours and hours
When the world got you down on your knees

All that I wanna do is to hold you tight
Love you until you're back on your feet
But it's hard when I'm laying my heart in your hands
And you don't hand yours back to me

Just give me something
I don't need it all, but you're giving nothin'
I'll take anything at all
Just give me something
'Cause all that I need is you
And you're giving nothin'
Just give me somethin'
I left you flowers outside your door
I see 'em dyin', it's killing me
Feel like a man on a walkin' wire
'Cause every chance you get, you're pushin' me

You can break every bone, I'm still standin' here
Waiting 'til you can finally see
You know all that we had, it was magic
Now tragically, I'm begging you please, oh

Just give me something
I don't need it all, but you're giving nothin'
I'll take anything at all
Just give me something
Cause all that I need is you
And you're giving nothing
Just give me something
Just give me something
Oh, just give me something
Oh, just give me something

I don't know how many nights
I can sit here waiting for you to come home
Just give me something
I don't need it all but you're giving nothing
I'll take anything at all
Just give me something
'Cause all that I need is you
And you're giving nothing

Just give me something
I don't need it all but you're giving nothing
I'll take anything at all
Just give me something
'Cause all that I need is you
And you're giving nothing
Just give me something
Just give me something
Oh just give me something
Oh just give me something2Embed",
Frank Sinatra,Platinum Selection,High Hopes,"Vocal Jazz, Pop",Freak37,/songs/20 - High Hopes.mp3,/image/cover-295.jpg,"High Hopes LyricsNext time you're found, with your chin on the ground
There a lot to be learned, so look around
Just what makes that little old ant
Think he'll move that rubber tree plant
Anyone knows an ant, can't
Move a rubber tree plant
But he's got high hopes, he's got high hopes
He's got high apple pie, in the sky hopes
So any time you're gettin' low
'stead of lettin' go
Just remember that ant
Oops, there goes another rubber tree plant
When troubles call, and your back's to the wall
There a lot to be learned, that wall could fall
Once there was a silly old ram
Thought he'd punch a hole in a dam
No one could make that ram, scram
He kept buttin' that dam
'Cause he had high hopes, he had high hopes
He had high apple pie, in the sky hopes
So any time you're feelin' bad
'stead of feelin' sad
Just remember that ram
Oops there goes a billion kilowatt dam
All problems just a toy balloon
They'll be bursted soon
They're just bound to go pop
Oops, there goes another problem kerplop1Embed",
Coldplay,Greatest Songs,Speed Of Sound,Rock / (131),https://musicriders.blogspot.com (or) Mega Zone Riders,/songs/20 - Speed Of Sound.mp3,/image/cover-296.jpg,"Speed of Sound Lyrics
How long before I get in?
Before it starts, before I begin?
How long before you decide?
Before I know what it feels like?
Where to, where do I go?
If you never try, then you'll never know
How long do I have to climb
Up on the side of this mountain of mine?

Look up, I look up at night
Planets are moving at the speed of light
Climb up, up in the trees
Every chance that you get
Is a chance you seize
How long am I gonna stand
With my head stuck under the sand?
I'll start before I can stop
Before I see things the right way up
All that noise, and all that sound
All those places I got found

And birds go flying at the speed of sound
To show you how it all began
Birds came flying from the underground
If you could see it, then you'd understand

Ideas that you'll never find
All the inventors could never design
The buildings that you put up
Japan and China all lit up
The sign that I couldn't read
Or a light that I couldn't see
Some things you have to believe
But others are puzzles, puzzling me

All that noise, and all that sound
All those places I got found

And birds go flying at the speed of sound
To show you how it all began
Birds came flying from the underground
If you could see it, then you'd understand
Ah when you see it, then you'll understand
All those signs, I knew what they meant
Some things you can invent
Some get made, and some get sent

Birds go flying at the speed of sound
To show you how it all began
Birds came flying from the underground
If you could see it then you'd understand

Oh, when you see it, then you'll understand24Embed",
