Artist,Album,Title,Genre,Comments,music_folder,image_folder,lyrics,
Camila Cabello,Familia,Lola (feat. Yotuel),Pop,,/songs/11 Lola (feat. Yotuel).mp3,/image/cover-176.jpg,"Camila Cabello - Lola ft. Yotuel (Tradução em Português) Lyrics

Isso é Camila Cabello
E Yotuel na casa, nada mais

Lola
Era a mais inteligente da escola, ela era uma supernova
Ela tinha uma mente além de seu tempo, foi uma emoção conhecê-la
Ela tinha sonhos que ela se apaixonaria, algum lugar como Barcelona
Lola, Lola, Lola

Ela poderia ter andado na lua, sim
Ela poderia nos encontrar uma cura
Mas a família não tinha comida e
Ela teve que deixar a escola para trabalhar
Ninguém quebra o teto
Ninguém de onde ela é
Ninguém quebra o teto, sim
Ninguém está ouvindo, então ela não vai falar, não vai falar
Todos esses sonhos estão desaparecendo lentamente, lentamente
Ela conhece as histórias sobre a polícia, polícia
É do jeito que é, então não fale, não fale

Lola
Ela acreditou no mundo que eles prometeram a ela, mas agora ela está mais velha
Ela viu as pessoas discordarem e desaparecerem
A energia acabou por dias, nenhuma comida está a caminho
Nada muda, este não é o sonho que eles nos venderam
Lola, Lola, Lola

Ela poderia ter andado na lua, sim
Poderia nos encontrar uma cura
Mas ela se preocupava com seus filhos
Noventa milhas até a costa
Ninguém quebra o teto
Ninguém de onde ela é
Ninguém quebra o teto, sim, ninguém

Ninguém está ouvindo, então ela não vai falar, não vai falar
Todos esses sonhos estão desaparecendo lentamente, lentamente
Ela conhece as histórias sobre a polícia, polícia
É do jeito que é, então não fale, não fale
Ela fica bem bonita como se estivesse pronta para um desfile
Eles prometeram que ela seria a rainha do Caribe
Mas alguém mudou o roteiro do seu filme
E para começar de novo, ela só pede
Do mundo baixo ela vem
Quanto você vale, quanto você tem
Esse é o preço da minha Lola quando não há saída
Ela quer liberdade, ela quer pátria e vida

Ninguém está ouvindo, então ela não vai falar, não vai falar
Todos esses sonhos estão desaparecendo lentamente, lentamente
Ela conhece as histórias sobre a polícia, polícia
É do jeito que é, então não fale, não fale

Ela queria tirar a dor
Matando o coração dela
Ela sonhava em voar
Mas o avião nunca decolou
Ela sofre, o tempo passa e sempre sozinha
Na minha Habana, quantas LolasEmbed",
Snow Patrol,Greatest Hits,You Could Be Happy,Alternative,,/songs/11 Snow Patrol - You Could Be Happy.mp3,/image/cover-177.jpg,"You Could Be Happy Lyrics

You could be happy and I won't know
But you weren't happy the day I watched you go
And all of the things that I wish I had not said
Are played in loops 'til it's madness in my head
Is it too late to remind you how we were?
Not our last days of silent screamin' blur
Most of what I remember makes me sure
I should have stopped you from walkin' out the door

You could be happy, I hope you are
You made me happier than I'd been by far
Somehow everything I own smells of you
And for the tiniest moment it's all not true
Do the things that you always wanted to
Without me there to hold you back, don't think, just do
More than anything I want to see you, girl
Take a glorious bite out of the whole world
10Embed",
Taylor Swift,Essentials,Wildest Dreams,Pop,Freak37,/songs/11 Wildest Dreams.mp3,/image/cover-178.jpg,"Wildest Dreams Lyrics
He said, ""Let's get out of this town
Drive out of the city, away from the crowds""
I thought, ""Heaven can't help me now""
Nothing lasts forever
But this is gonna take me down

He's so tall and handsome as hell
He's so bad, but he does it so well
I can see the end as it begins
My one condition is

Say you'll remember me
Standin' in a nice dress
Starin' at the sunset, babe
Red lips and rosy cheeks
Say you'll see me again
Even if it's just in your
Wildest dreams, ah, ha
Wildest dreams, ah, ha
I said, ""No one has to know what we do""
His hands are in my hair, his clothes are in my room
And his voice is a familiar sound
Nothin' lasts forever
But this is gettin' good now

He's so tall and handsome as hell
He's so bad, but he does it so well
And when we've had our very last kiss
My last request is

Say you'll remember me
Standin' in a nice dress
Starin' at the sunset, babe
Red lips and rosy cheeks
Say you'll see me again
Even if it's just in your
Wildest dreams, ah, ha (Ha, ha)
Wildest dreams, ah, ha

You'll see me in hindsight
Tangled up with you all night
Burnin' it down
Someday, when you leave me
I bet these memories
Follow you around
You'll see me in hindsight
Tangled up with you all night
Burnin' (Burnin') it (It) down (Down)
Someday, when you leave me
I bet these memories
Follow (Follow) you (You) around
(Follow you around)
Say you'll remember me
Standing in a nice dress
Starin' at the sunset, babe
Red lips and rosy cheeks
Say you'll see me again
Even if it's just pretend

Say you'll remember me
Standin' in a nice dress
Starin' at the sunset, babe
Red lips and rosy cheeks
Say you'll see me again
Even if it's just in your (Just pretend, just pretend)
Wildest dreams, ah, ha (Ah)
In your wildest dreams, ah, ha
Even if it's just in your
In your wildest dreams, ah, ha
In your wildest dreams, ah, ha274Embed",
Calum Scott,Only Human (Deluxe),Hotel Room,-13,https://musicriders.blogspot.com,/songs/11. Hotel Room.mp3,/image/cover-179.jpg,"Hotel Room Lyrics
What's on your mind?
'Cause I've been thinking 'bout last night
What's the time?
Feels like I've sat here all my life

Your ship rolls in, I'm here waiting
I don't know why, I'm paralysed
Oh, what I'd do to be with you
Oh, what I'd give

To hear you say that ""I love you""
But say it the way I do
There's nowhere to run tonight
It's just you and I in this hotel room
And say that ""I miss you""
But say it the way I do
There's nowhere to hide tonight
My eyes can't lie, the way I feel for you
Just give me a moment, it's all I ask of you
While I'm dying in this hotel room
Couldn't work out why you gave me all those signs
So tell me now before I lose my mind

Your ship sails in, I am waiting
You stand close by, and watch me cry
Oh, what I'd do to be with you
Oh, what I'd give

To hear you say that ""I love you""
But say it the way I do
There's nowhere to run tonight
It's just you and I in this hotel room
And say that 'I miss you'
But say it the way I do
There's nowhere to hide tonight
My eyes can't lie, the way I feel for you
Just give me a moment, it's all I ask of you
While I'm dying in this hotel room

Hold out your hand
Give me a light in the dark
You know that I'm broken
Don't leave me here broken
To hear you say that ""I love you""
But hear it the way I do
There's nowhere to run tonight
It's just you and I in this hotel room
And say that ""I miss you""
But say it the way I do
There's nowhere to hide tonight
My eyes can't lie, the way I feel for you
Just give me a moment, it's all I ask of you
Oh, give me a moment, it's all I ask of you
While I'm dying in this hotel roomEmbed",
Ed Sheeran,=,Love In Slow Motion,,PMEDIA,/songs/11. Love In Slow Motion.mp3,/image/cover-180.jpg,"Love in Slow Motion Lyrics
It's been a while since we've been alone
To turn off the world and the telephone
I need to tell you you're beautiful
'Cause it's been a while and I apologize
I just get caught up in the rat race I'm runnin'
Chasin' a moment, I'm hoping is comin'
If I stopped and took a look around
It's in front of my eyes, eyes

Baby, let's slow down time
Maybe just press rewind
Darlin', that dress reminds
Me of the first time
And I wanna love tonight
One on one by the candlelight
Over and over, we spend our lives
Living fast forward but not tonight
Love in slow motion

It's been a while since it was you and me
Too many friends, too many evening drinks
Yeah, we commit to so many things
But not to ourselves, and I apologize
Sometimes you're sad and you tell me it's nothin'
And I brush it off because there's always somethin'
But I need to change my perspective
And prioritize-ize

'Cause one thing I know, it's this
Every moment missed
Can be restored with your lips
It only takes one kiss

And I wanna love tonight
One on one by the candlelight
Over and over, we spend our lives
Living fast forward but not tonight
Love in slow motion
Ooh-ooh
Ooh-ooh

Love tonight
One on one by the candlelight
Over and over, we spend our lives
Living fast forward but not tonight
Love in slow motion
Wanna love tonight
One on one by the candlelight
Over and over, we spend our lives
Living fast forward but not tonight
Love in slow motion

In slow motion
In slow motion5Embed",
Oasis,Oasis - Greatest Hits CD2,Oasis  Lyla,,,/songs/11. Oasis  Lyla.mp3,,"Lyla Lyrics
Calling all the stars to fall
And catch the silver sunlight in your hands
Come for me and set me free
Lift me up and take me where I stand
She believes in everything
And everyone and you and yours and mine
I've waited for a thousand years
For you to come and blow me out my mind

Hey Lyla!
The stars about to fall
So what do you say, Lyla?
The world around us makes me feel so small, Lyla!
If you can't hear me call then I can't say, Lyla!
Heaven help you catch me if I fall!
She's the queen of all I've seen
And every song and city far and near
Heaven-Hell my mademoiselle
She ring the bell for all the world to hear

Hey Lyla!
The stars about to fall
So what do you say, Lyla?
The world around us makes me feel so small, Lyla!
If you can't hear me call then I can't say, Lyla!
Heaven help you catch me if I fall!
Hey Lyla!
The stars about to fall
So what do you say, Lyla?
The world around us makes me feel so small, Lyla!
If you can't hear me call then I can't say, Lyla!
Heaven help you catch me if I fall!

Hey Lyla!
Hey Lyla!
Hey Lyla!3Embed",
Katy Perry,Smile (Deluxe),Only love,Pop,Freak37,/songs/11. Only Love.mp3,/image/cover-182.jpg,"Only Love Lyrics
Only love, only love
Only love, only love

Eighty-six thousand, four hundred seconds in a day
I swear lately most of 'em have been a waste
I feel 'em come and go, bury my mistakes
But time just goes on and on in a way

If I had one day left to live
And if the stars went out on me, the truth is
Yeah, there's so much I'd say and do
If I had nothing to lose, nah, nothing to lose
Oh, I'd call my mother and tell her I'm sorry
I never call her back
I'd pour my heart and soul out into a letter
And send it to my dad
Like, oh my God, the time I've wasted
Lost in my head
Let me leave this world with the hate behind me
And take the love instead

Give me
Only love, only love
Give me
Only love, only love

I swear sometimes I hear myself talking, getting mad
Take shit so personal, like it really matters
Oh, am I awake, am I sleepwalking? Tell me that
It's scary how quickly I lose perspective and I react

If I had one day left to live
And if the stars went out on me, the truth is
Yeah, there's so much I'd say and do
If I had nothing to lose, no, nothing to lose
Oh, I'd call my mother and tell her I'm sorry
I never call her back
I'd pour my heart and soul out into a letter
And send it to my dad
Like, oh my God, the time I've wasted
Lost in my head
Let me leave this world with the hate behind me
And take the love instead

Give me
Only love, only love
Give me
Only love, only love (No)
Yeah, give me
Only love, only love
Let me leave this world with the hate behind me
And take the love instead
Give me (Mmm)
Only love, only love (Only love, only love)
Give me
Only love, only love (Only love, only love, only love)
Only love, only love (Oh, no, only love)
Let me leave this world with the hate behind me (Oh)
And take the love instead
Let me leave this world with the hate behind me
And take the love instead
Give me
Only love, only love
Yeah, give me
Only love, only love8Embed",
Snoop Dogg,BODR,Outside The Box (feat. Nate Dogg),,PMEDIA,/songs/11. Outside The Box (feat. Nate Dogg).mp3,/image/cover-183.jpg,"Outside the Box Lyrics
Yeah, this is dedicated to the niggas that was down from day one
Welcome back

Every time I turn around, every time they hear my sound
They get me all up underground, still inside the box
Fuck what they say, just be, the Black folk like it, it's a hit
How can this true gangster shit be still outside the box?

We came from a place where our hearts are pure
People wanna know what we're marchin' for
Grouped up, scooped up all my pals
Flavor for days, so much style
They can't even put it in a box now (Wow)
Stepped out, gator smile, wait a while
""Excuse me, Snoopy, can we get a flick?""
I ain't really trippin', go on, take that shit
What? It's really gon' be 'bout gettin' love
And that's only 'cause I give love
I stand up for it, I manned up for it like a brother 'posed to
Went through, go through, goin' through, knowin' you
Showin' you, flowin' to and the mental to grow into
Let bygones be bygones
So you can be an icon like I've done

Every time I turn around, every time they hear my sound
They get me all up underground, still inside the box
Fuck what they say, just be, the Black folk like it, it's a hit
How can this true gangster shit be still outside the box?

Own it like I want it, that's 24/7
Me and my dawgs on the highway to Heaven
Just put a Funko in 7-Eleven
It's a trifecta, me, Jasmine, and Kevin
Built a massive team that's passion themed
Do it for the love, on top there's the cream
I do it 'til I did that, get enough
Run it up, rake enough, make enough to give back

What? It's really gon' be 'bout gettin' love
And that's only 'cause I give love
I stand up for it, I manned up for it like a brother 'posed to
Went through, go through, goin' through, knowin' you
Showin' you, flowin' to and the mental to grow into
Let bygones be bygones
So you can be an icon like I've done
Every time I turn around, every time they hear my sound
They get me all up underground, still inside the box
Fuck what they say, just be, the Black folk like it, it's a hit
How can this true gangster shit be still outside the box?Embed",
Imagine Dragons,Origins (Deluxe),Stuck,Alternative,Freak37,/songs/11. Stuck.mp3,/image/cover-184.jpg,"Stuck Lyrics
Time goes by and still I am stuck on you
Yeah, time goes by and still I am stuck on you, ooh, you, ooh

I've been afraid, don't wanna fade out of my body
I've been astray, barely awake, floating above me
Covered in gray, what can I say? I've been a zombie
I'm feeling like I've been locked in a grave
You were the laugh, you were the life, you were the party
You were the brave, I was the weak, you were the army
You were the faith, you were the truth, I was the sorry
I'm feeling like you've been taken away

You were my one, you were my one
When all has been said, all has been done
You were my one, you were my one
Now I am left reaching above me, oh, oh
Time goes by and still I am stuck on you
Ooh, you, ooh (Woah-oh)
Yeah, time goes by and still I am stuck on you
Ooh, you, ooh (Woah-oh)

Why did you leave? Why did you go leaving me lonely?
Didn't you know you were the home, you were the only?
Where did you go? Where did you go? Where did you go?
Come back to me

You were my one, you were my one
When all has been said, all has been done
You were my one, you were my one
Now I am left reaching above me, oh, oh

Time goes by and still I am stuck on you
Ooh, you, ooh (Woah-oh)
Time goes by and still I am stuck on you
Ooh, you, ooh (Woah-oh)
Time goes by and still I am stuck on you
Yeah, time goes by and still I am stuck on you, stuck on you
Oh, oh, oh, woah (Woah-oh, woah, oh)
Oh, oh, oh
As time goes by, as time goes by, woah
Time goes by and still I am stuck on you
Ooh, you, ooh (Woah-oh)
Time goes by and still I am stuck on you
Ooh, you, ooh (Woah-oh)11Embed",
Camila Cabello,Romance,This Love,Pop,Freak37,/songs/11. This Love.mp3,/image/cover-185.jpg,"This Love Lyrics
No, no, no

Know just how to make me miss ya
When I'm feelin' sentimental
Goin' in our separate ways
But wind up back here in the middle
Losin' you I couldn't face
But to love you is worse
Waitin' for you just in case
One day it doesn't hurt, nah, nah, nah

Said it's the last time, but nah, nah, nah, nah
Just like the last time, yeah, nah, nah, nah, nah
Tired of building up my walls, yeah
Just to watch them fall again
So fuck this love callin' my name
Get out of my veins
If you need your space, then just walk away
You know how to fuck me up, then make it okay
I guess that's just your game
And I'm the one who gets played
Again, and again, and again, and again

Maybe you should set me free
Maybe I don't really want you to
Maybe I just wanna be
Be the person that you just can't lose
If you're gonna leave, then go
If you need me, let me know
Love me or just let me go
But no, nah, nah, nah

Said it's the last time, but nah, nah, nah, nah
Just like the last time, yeah, nah, nah, nah, nah
Tired of building up my walls, yeah
Just to watch them fall again

Fuck this love callin' my name
Get out of my veins
If you need your space, then just walk away
You know how to fuck me up, then make it okay
I guess that's just your game
And I'm the one who gets played
Again, and again, and again, and again
Maybe you should set me free
Maybe I don't really want you to
Maybe I just wanna be
Be the person that you just can't lose
No, there I go and fall again

Fuck this love (Yeah yeah) callin' my name
Get out of my veins (Get out of my veins)
If you need your space, then just walk away
You know how to fuck me up, then make it okay
I guess that's just your game (That's just your game)
And I'm the one who gets played
Again, and again, and again, and again, and again

Ooh, oh, again
Oh, no
Here I go again28Embed",
Harry Styles,Fine Line,Treat People With Kindness,Pop,www.t.me/pmedia_music,/songs/11. Treat People With Kindness.mp3,/image/cover-186.jpg,"Treat People With Kindness Lyrics
Maybe, we can
Find a place to feel good
And we can treat people with kindness
Find a place to feel good

I've got a good feeling
I'm just takin' it all in
Floating up and dreamin'
Droppin' into the deep end

And if we're here long enough
They'll sing a song for us
And we'll belong
Maybe, we can
Find a place to feel good
And we can treat people with kindness
Find a place to feel good

Giving second chances
I don't need all the answers
Feeling good in my skin
I just keep on dancin'

And if we're here long enough
We'll see it's all for us
And we'll belong

Maybe, we can
Find a place to feel good
And we can treat people with kindness
Find a place to feel good

And it's just another day (And it's just another day)
And if our friends all pass away (Oh-oh, oh-oh)
It's okay (It's okay, it's okay)
It's okay (It's okay, it's okay, yeah)
Hey!
Here we go now
Maybe, we can
Find a place to feel good
And we can treat people with kindness
Find a place to feel good

All we ever want is automatic all the time
All we ever want is auto, auto all of the time
All we ever want is automatic all the time
All we ever want is auto, auto all of the time
Maybe, we can (All together now, one more time)
Find a place to feel good (Oh yeah)
And we can treat people with kindness (Just a little bit of kindness)
Find a place to feel good (Ow)30Embed",
John Mayer,Essentials,Why Georgia,Pop,www.t.me/pmedia_music,/songs/11. Why Georgia.mp3,/image/cover-187.jpg,"Why Georgia Lyrics
I am driving up '85 in the
Kind of morning that lasts all afternoon
Just stuck inside the gloom
4 more exits to my apartment but
I am tempted to keep the car in drive
And leave it all behind

Because I wonder sometimes
About the outcome
Of a still verdictless life

Am I living it right?
Am I living it right?
Am I living it right?
Why Georgia, why?
I rent a room and I fill the spaces with
Wood in places to make it feel like home
But all I feel's alone
It might be a quarter life crisis
Or just the stirring in my soul

Either way--I wonder sometimes
About the outcome
Of a still verdictless life

Am I living it right?
Am I living it right?
Am I living it right?
Why Georgia, why?

So what, so I've got a smile on
But it's hiding the quiet superstitions in my head
Don't believe me
Don't believe me
When I say I've got it down

Everybody is just a stranger but
That's the danger in going my own way
I guess it's the price I have to pay
Still ""everything happens for a reason""
Is no reason not to ask myself

Am I living it right?
Am I living it right?
Am I living it right?
Why? Tell me why?
Why? Why Georgia, why?12Embed",
Nirvana,Greatest Hits,Rape Me,Grunge,,/songs/11.Rape Me.mp3,/image/cover-188.jpg,"Rape Me Lyrics
Rape me
Rape me, my friend
Rape me
Rape me again

I'm not the only one, ah-ah
I'm not the only one, ah-ah
I'm not the only one, ah-ah
I'm not the only one

Hate me
Do it and do it again
Waste me
Rape me, my friend
I'm not the only one, ah-ah
I'm not the only one, ah-ah
I'm not the only one, ah-ah
I'm not the only one

My favorite inside source
I'll kiss your open sores
I appreciate your concern
You're gonna stink and burn

Rape me
Rape me, my friend
Rape me
Rape me again

I'm not the only one, ah-ah
I'm not the only one, ah-ah
I'm not the only one, ah-ah
I'm not the only one

Rape me! (Rape me!)
Rape me! (Rape me!)
Rape me! (Rape me!)
Rape me! (Rape me!)
Rape me! (Rape me!)
Rape me! (Rape me!)
Rape me!63Embed",
Frank Sinatra,Platinum Selection,Both Sides Now,"Vocal Jazz, Pop",Freak37,/songs/12 - Both Sides Now.mp3,/image/cover-189.jpg,"From Both Sides, Now Lyrics
Bows and flows of angel hair
And ice cream castles in the air
And feather canyons everywhere
I've looked at clouds that way
But now they only block the sun
They rain and snow on everyone
So many things I would have done
But clouds got in my way

I've looked at clouds from both sides now
From up and down and still somehow
It's cloud's illusions I recall
I really don't know clouds at all
Moons and Junes and ferris wheels
The dizzy dancing way you feel
As every fairy tale comes real
I've looked at love that way
But now it's just another show
You leave 'em laughing when you go
And if you care don't let 'em know
Don't give yourself away

I've looked at love from both sides now
From give and take and still somehow
It's love's illusions I recall
I really don't know love at all

Tears and fears and feeling proud
To say, ""I love you"" right out loud
Dreams and schemes and circus crowds
I've looked at life that way
But now old friends are acting strange
They shake their heads, they say I've changed
But something's lost but something's gained
In living every day
I've looked at life from both sides now
Win and lose and still somehow
It's life's illusions I recall
I really don't know life, don't know it at allEmbed",
Dua Lipa,Dua Lipa,Homesick,Indie Pop / Pop,Hunter,/songs/12 - Homesick.mp3,/image/cover-190.jpg,"Homesick Lyrics
Here, where the sky's falling
I'm covered in blue
I'm running and I'm crawling
Fighting for you
When the rain stops, then, darling, what will I do?
And I know I go all in, but why do I?

You give me a reason, something to believe in
I know, I know, I know
You give me a meaning, something I can breathe in
I know, I know, I know
It's a bittersweet feeling
Longing, and I'm leaving
I go, I go, I go
But I wish I was there with you
Oh, I wish I was there with you
There's a crack in my window
A bird in my room
Angels all over that watch over you
When I'm walking on water
All my dreams have come true
Still, nothing means nothing
Without you, you

You give me a reason, something to believe in
I know, I know, I know
You give me a meaning, something I can breathe in
I know, I know, I know
It's a bittersweet feeling
Longing, and I'm leaving
I go, I go, I go
Tell my heart to lie, but I know deep inside it's true
That I wish I was there with you
That I wish I was there with you
Oh, I wish I was there with you


You give me a reason, something to believe in
I know, I know, I know
You give me a meaning, something I can breathe in
I know, I know, I know
It's a bittersweet feeling
Longing, and I'm leaving
I go, I go, I go
Tell my heart to lie, but I know deep inside it's true
That I wish I was there with you
That I wish I was there with you
Oh, I wish I was there with you35Embed",
Coldplay,Greatest Songs,Paradise,Rock / (131),https://musicriders.blogspot.com (or) Mega Zone Riders,/songs/12 - Paradise.mp3,/image/cover-191.jpg,"Paradise Lyrics

Ooh-ooh-ooh, ooh-ooh-ooh, ooh-ooh-ooh
Ooh-ooh-ooh, ooh-ooh-ooh, ooh-ooh-ooh
When she was just a girl
She expected the world
But it flew away from her reach
So she ran away in her sleep

And dreamed of para-para-paradise
Para-para-paradise
Para-para-paradise
Every time she closed her eyes
Ooh-ooh-ooh, ooh-ooh-ooh, ooh-ooh-ooh
Ooh-ooh-ooh, ooh-ooh-ooh, ooh-ooh-ooh
When she was just a girl
She expected the world
But it flew away from her reach
And the bullets catch in her teeth

Life goes on, it gets so heavy
The wheel breaks the butterfly
Every tear, a waterfall
In the night, the stormy night, she'd close her eyes
In the night, the stormy night, away she'd fly

And dream of para-para-paradise
Para-para-paradise
Para-para-paradise
Oh, oh-oh, oh-oh, oh-oh-oh
She'd dream of para-para-paradise
Para-para-paradise
Para-para-paradise
Oh, oh-oh, oh-oh, oh-oh-oh

La, la-la, la-la-la
La, la-la, la-la-la
La, la-la, la-la-la, la-la
So lying underneath those stormy skies
She said, ""Oh, oh-oh-oh-oh I know the sun must set to rise""
This could be para-para-paradise
Para-para-paradise
This could be para-para-paradise
Oh, oh-oh, oh-oh, oh-oh-oh
This could be para-para-paradise
Para-para-paradise
This could be para-para-paradise
Oh, oh-oh, oh-oh, oh-oh-oh


This could be para-para-paradise
This could be para-para-paradise
This could be para-para-paradise
Oh-oh-oh-oh-oh oh-oh-oh

Ooh-ooh-ooh, ooh-ooh-ooh, ooh-ooh-ooh
Ooh-ooh-ooh, ooh-ooh-ooh, ooh-ooh-ooh
Ooh-ooh-ooh, ooh-ooh-ooh, ooh-ooh-ooh
Ooh-ooh-ooh, ooh-ooh-ooh...98Embed",
